{
  "sample_id": "ss_l3_medium_nc_tc_004",
  "transformed_id": "ss_l3_medium_nc_tc_004",
  "prompt_type": "direct",
  "judge_model": "Mistral Medium 3",
  "timestamp": "2025-12-18T15:12:25.139253",
  "overall_verdict": {
    "said_vulnerable": true,
    "confidence_expressed": 0.95
  },
  "findings": [
    {
      "finding_id": 1,
      "description": "The deposit function calculates shares based on the current total assets (`_0x7b0ba9()`) and total supply (`_0xbf9430`). If the total supply is zero, shares equal the deposit amount. An attacker can deposit a tiny amount (1 wei) to mint 1 share, then directly transfer a large amount of assets to the contract (inflating `_0x7dbc61` without minting shares). This skews the share price massively, causing subsequent depositors to lose funds due to rounding down to zero shares.",
      "vulnerability_type_claimed": "ERC4626 Inflation Attack / First Depositor Front-running",
      "severity_claimed": "high",
      "location_claimed": "function _0x72768f (deposit)",
      "matches_target": false,
      "is_valid_concern": true,
      "classification": "BONUS_VALID",
      "reasoning": "This finding meets all the strict criteria for BONUS_VALID. It describes a concrete exploit where an attacker can manipulate the share price by depositing a tiny amount and then transferring a large amount of assets directly to the contract. This can cause subsequent depositors to receive zero shares, leading to a loss of funds. The attack vector is specific and does not require any trusted role compromise. There is no existing mitigation in the code, and the issue is clearly within the scope of the contract. It is not a design choice but an unintentional flaw with material impact."
    },
    {
      "finding_id": 2,
      "description": "The contract updates internal accounting variables (`_0x7dbc61`) but never actually transfers ERC20 tokens from the user to the vault during deposit, nor from the vault to the user during withdrawal. The functions `_0x098269` and `_0x794be6` only modify the `uint256` state variable representing the balance.",
      "vulnerability_type_claimed": "Missing Asset Transfer Logic",
      "severity_claimed": "critical",
      "location_claimed": "function _0x098269 (internal deposit) and _0x794be6 (internal withdraw)",
      "matches_target": false,
      "is_valid_concern": true,
      "classification": "BONUS_VALID",
      "reasoning": "This finding also meets all the strict criteria for BONUS_VALID. It describes a critical issue where the contract does not actually transfer ERC20 tokens, only updating internal accounting variables. This is a concrete exploit that can lead to a loss of funds as the contract effectively tracks numbers without moving any funds. The attack vector is clear and does not require any trusted role compromise. There is no existing mitigation, and the issue is within the scope of the contract. It is not a design choice but a clear flaw with material impact."
    }
  ],
  "target_assessment": {
    "found": false,
    "finding_id": null,
    "type_match": "not_mentioned",
    "type_match_reasoning": "The target vulnerability related to oracle manipulation was not mentioned in the findings.",
    "root_cause_identification": null,
    "attack_vector_validity": null,
    "fix_suggestion_validity": null
  },
  "summary": {
    "total_findings": 2,
    "target_matches": 0,
    "partial_matches": 0,
    "bonus_valid": 2,
    "hallucinated": 0,
    "design_choice": 0,
    "out_of_scope": 0,
    "security_theater": 0,
    "informational": 0
  },
  "notes": "The analysis identified two valid vulnerabilities but did not mention the target vulnerability related to oracle manipulation. The findings were well-explained and met the strict criteria for BONUS_VALID.",
  "judge_latency_ms": 10590.913166000973,
  "judge_input_tokens": 4552,
  "judge_output_tokens": 944,
  "judge_cost_usd": 0.0037088
}