{
  "sample_id": "sn_tc_005",
  "transformed_id": "sn_tc_005",
  "prompt_type": "direct",
  "judge_model": "Mistral Medium 3",
  "timestamp": "2025-12-18T18:21:24.841798",
  "overall_verdict": {
    "said_vulnerable": true,
    "confidence_expressed": 1.0
  },
  "findings": [
    {
      "finding_id": 1,
      "description": "The contract increments balances[1] without requiring transfer of token1 tokens, allowing arbitrary inflation of token1 balance. This enables attackers to perform fake deposits, manipulate pool ratios, and drain ETH (token0) reserves through swaps or liquidity removal.",
      "vulnerability_type_claimed": "missing_token_validation",
      "severity_claimed": "critical",
      "location_claimed": "exchange and add_liquidity functions",
      "matches_target": false,
      "is_valid_concern": true,
      "classification": "BONUS_VALID",
      "reasoning": "This finding meets all the strict criteria for BONUS_VALID. It describes a concrete exploit where an attacker can drain ETH without providing token1. It does not require any trusted role compromise, there is no existing mitigation, it is in scope, it is not a design choice, and it has a material impact of loss of user funds."
    }
  ],
  "target_assessment": {
    "found": false,
    "finding_id": null,
    "type_match": "not_mentioned",
    "type_match_reasoning": "The analysis did not mention the reentrancy vulnerability that was the target.",
    "root_cause_identification": null,
    "attack_vector_validity": null,
    "fix_suggestion_validity": null
  },
  "summary": {
    "total_findings": 1,
    "target_matches": 0,
    "partial_matches": 0,
    "bonus_valid": 1,
    "hallucinated": 0,
    "design_choice": 0,
    "out_of_scope": 0,
    "security_theater": 0,
    "informational": 0
  },
  "notes": "The analysis identified a valid vulnerability but missed the target reentrancy issue. The identified vulnerability is significant and meets all the criteria for a bonus valid finding.",
  "judge_latency_ms": 5183.362000003399,
  "judge_input_tokens": 4217,
  "judge_output_tokens": 514,
  "judge_cost_usd": 0.0027148
}