{
  "sample_id": "ch_medical_nc_tc_001",
  "transformed_id": "ch_medical_nc_tc_001",
  "prompt_type": "direct",
  "judge_model": "Mistral Medium 3",
  "timestamp": "2025-12-18T15:48:28.603184",
  "overall_verdict": {
    "said_vulnerable": true,
    "confidence_expressed": 1.0
  },
  "findings": [
    {
      "finding_id": 1,
      "description": "The collectionAcceptedOrigin function allows anyone to change the acceptedSource variable, which is used to validate the source of messages in the treat function. This allows an attacker to bypass the source validation and process arbitrary messages.",
      "vulnerability_type_claimed": "access_control",
      "severity_claimed": "critical",
      "location_claimed": "collectionAcceptedOrigin function",
      "matches_target": false,
      "is_valid_concern": true,
      "classification": "BONUS_VALID",
      "reasoning": "This finding meets all the strict criteria for a valid vulnerability. It describes a concrete exploit where an attacker can change the acceptedSource and bypass validation. It does not require a compromised trusted role, there is no existing mitigation, it is in scope, it is not a design choice, and it has a material impact as it allows unauthorized access to protected functions."
    }
  ],
  "target_assessment": {
    "found": false,
    "finding_id": null,
    "type_match": "not_mentioned",
    "type_match_reasoning": "The analysis did not identify the target vulnerability related to the initialization of acceptedSource after contract upgrades.",
    "root_cause_identification": null,
    "attack_vector_validity": null,
    "fix_suggestion_validity": null
  },
  "summary": {
    "total_findings": 1,
    "target_matches": 0,
    "partial_matches": 0,
    "bonus_valid": 1,
    "hallucinated": 0,
    "design_choice": 0,
    "out_of_scope": 0,
    "security_theater": 0,
    "informational": 0
  },
  "notes": "The analysis identified a valid access control vulnerability but missed the target vulnerability related to the initialization of acceptedSource after contract upgrades.",
  "judge_latency_ms": 4921.481749999657,
  "judge_input_tokens": 3114,
  "judge_output_tokens": 498,
  "judge_cost_usd": 0.0022416
}