{
  "sample_id": "sn_gs_020",
  "transformed_id": "sn_gs_020",
  "prompt_type": "direct",
  "judge_model": "Mistral Medium 3",
  "timestamp": "2025-12-18T15:12:54.256671",
  "overall_verdict": {
    "said_vulnerable": false,
    "confidence_expressed": 0.78
  },
  "findings": [],
  "target_assessment": {
    "found": false,
    "finding_id": null,
    "type_match": "not_mentioned",
    "type_match_reasoning": "The analysis did not mention the target vulnerability at all.",
    "root_cause_identification": null,
    "attack_vector_validity": null,
    "fix_suggestion_validity": null
  },
  "summary": {
    "total_findings": 0,
    "target_matches": 0,
    "partial_matches": 0,
    "bonus_valid": 0,
    "hallucinated": 0,
    "design_choice": 0,
    "out_of_scope": 0,
    "security_theater": 0,
    "informational": 0
  },
  "notes": "The analysis concluded that the contract is safe and did not identify any vulnerabilities, including the target vulnerability. The analysis was thorough in explaining why no concrete exploit paths were found, but it missed the specific input validation issue in the withdrawPhantomToken function.",
  "judge_latency_ms": 4325.368541998614,
  "judge_input_tokens": 4734,
  "judge_output_tokens": 312,
  "judge_cost_usd": 0.0025176
}